{
  "schema": "phaseflow.index/v1",
  "engine_version": "0.10.000",
  "n_cases": 13,
  "cases": [
    {
      "case_id": "ctrl-abundant",
      "category": "control",
      "manifest_path": "manifests/ctrl-abundant.json",
      "default": false,
      "lane": "live",
      "title": {
        "en": "Control: capacity barely binds",
        "es": "Control: la capacidad casi no limita"
      },
      "role": {
        "en": "Loose-capacity diagnostic. The best CPIT schedule approaches the certified bound, but classical schedules still lose value because period timing and slope precedence matter at a positive discount rate. The zero-rate, single-period ctrl-degenerate case is the exact collapse control; this one is not.",
        "es": "Diagnóstico con capacidad holgada. El mejor plan CPIT se acerca a la cota certificada, pero los planes clásicos pierden valor porque el período de extracción y la precedencia importan con descuento positivo. ctrl-degenerate, con tasa cero y un período, es el control de colapso exacto; este no lo es."
      }
    },
    {
      "case_id": "ctrl-degenerate",
      "category": "control",
      "manifest_path": "manifests/ctrl-degenerate.json",
      "default": false,
      "lane": "live",
      "title": {
        "en": "Control: rate zero, capacity unlimited",
        "es": "Control: tasa cero, capacidad ilimitada"
      },
      "role": {
        "en": "The degenerate case. CPIT collapses to the ultimate pit: the mined set must equal the exact pit block for block and the bound must equal its value. A failure here is a bug, not a result.",
        "es": "El caso degenerado. CPIT colapsa al pit final: el conjunto extraído debe igualar al pit exacto bloque a bloque y la cota debe igualar su valor. Fallar aquí es un error, no un resultado."
      }
    },
    {
      "case_id": "kd-declared",
      "category": "declared",
      "manifest_path": "manifests/kd-declared.json",
      "default": false,
      "lane": "replay",
      "title": {
        "en": "KD, declared scenario",
        "es": "KD, escenario declarado"
      },
      "role": {
        "en": "A copper deposit from Arizona, again under a declared scenario. Scale check.",
        "es": "Un yacimiento de cobre de Arizona, también bajo escenario declarado. Prueba de escala."
      }
    },
    {
      "case_id": "newman1-published",
      "category": "published",
      "manifest_path": "manifests/newman1-published.json",
      "default": false,
      "lane": "replay",
      "title": {
        "en": "Newman1, as published",
        "es": "Newman1, tal como se publica"
      },
      "role": {
        "en": "The trust anchor. A published MineLib instance solved with its own periods, its own discount rate and its own two capacities. The 2018 comparison is a PCPSP result, while an external AMPL notebook reports a separate CPIT integer optimum.",
        "es": "El ancla de confianza. Una instancia publicada de MineLib resuelta con sus propios períodos, su propia tasa y sus dos capacidades. La comparación de 2018 es PCPSP; un cuaderno externo de AMPL informa por separado un óptimo entero CPIT."
      }
    },
    {
      "case_id": "regime-high-discount",
      "category": "regime",
      "manifest_path": "manifests/regime-high-discount.json",
      "default": false,
      "lane": "live",
      "title": {
        "en": "Impatient capital",
        "es": "Capital impaciente"
      },
      "role": {
        "en": "Twenty percent per period. High grade is pulled forward hard and the early pit is a visibly different shape from the ten percent case on the same deposit.",
        "es": "Veinte por ciento por período. La alta ley se adelanta con fuerza y el rajo temprano tiene una forma visiblemente distinta al caso de diez por ciento en el mismo depósito."
      }
    },
    {
      "case_id": "regime-mill-bound",
      "category": "regime",
      "manifest_path": "manifests/regime-mill-bound.json",
      "default": false,
      "lane": "live",
      "title": {
        "en": "Mill-bound regime",
        "es": "Régimen limitado por planta"
      },
      "role": {
        "en": "Plant capacity binds every period while the shovels idle. This is the regime where a stockpile would pay, and where the app says why it is not offering one.",
        "es": "La planta limita cada período mientras las palas sobran. Es el régimen donde un acopio pagaría, y donde la aplicación explica por qué no lo ofrece."
      }
    },
    {
      "case_id": "regime-mining-bound",
      "category": "regime",
      "manifest_path": "manifests/regime-mining-bound.json",
      "default": false,
      "lane": "live",
      "title": {
        "en": "Mining-bound regime",
        "es": "Régimen limitado por mina"
      },
      "role": {
        "en": "The fleet binds and the plant idles: the mirror image, and a different pit shape.",
        "es": "La flota limita y la planta sobra: la imagen espejo, y otra forma de rajo."
      }
    },
    {
      "case_id": "twin-core-halo",
      "category": "deposit",
      "manifest_path": "manifests/twin-core-halo.json",
      "default": false,
      "lane": "live",
      "title": {
        "en": "Core and halo twin",
        "es": "Gemelo de núcleo y halo"
      },
      "role": {
        "en": "Concentric grade. Nested pits look sensible on this deposit and the schedule still does something different, which is the point of solving rather than nesting. With the vein it is one of the two archetypes on which the learned rung is measured to fail most: a thin rich core makes the order of extraction delicate.",
        "es": "Ley concéntrica. Los pits anidados se ven razonables en este depósito y el plan igual hace algo distinto, que es el punto de resolver en vez de anidar. Junto con la veta es uno de los dos arquetipos en que el peldaño aprendido falla más: un núcleo rico y delgado vuelve delicado el orden de extracción."
      }
    },
    {
      "case_id": "twin-layered",
      "category": "deposit",
      "manifest_path": "manifests/twin-layered.json",
      "default": false,
      "lane": "live",
      "title": {
        "en": "Layered twin",
        "es": "Gemelo estratificado"
      },
      "role": {
        "en": "Strong stratification: the pushbacks come out as benches rather than as cones.",
        "es": "Estratificación fuerte: los pushbacks salen como bancos y no como conos."
      }
    },
    {
      "case_id": "twin-porphyry-l",
      "category": "deposit",
      "manifest_path": "manifests/twin-porphyry-l.json",
      "default": true,
      "lane": "live",
      "title": {
        "en": "Porphyry twin, large",
        "es": "Gemelo de pórfido, grande"
      },
      "role": {
        "en": "The hero case. Big enough that the pit wall reads as benches rather than voxels, and license-free, so its whole per-block schedule ships to the browser.",
        "es": "El caso principal. Suficientemente grande para que la pared se lea como bancos y no como voxeles, y libre de licencia, así que su plan por bloque completo viaja al navegador."
      }
    },
    {
      "case_id": "twin-porphyry-s",
      "category": "deposit",
      "manifest_path": "manifests/twin-porphyry-s.json",
      "default": false,
      "lane": "live",
      "title": {
        "en": "Porphyry twin, small",
        "es": "Gemelo de pórfido, pequeño"
      },
      "role": {
        "en": "The smaller porphyry: the browser re-solves its bound and three plans in about two seconds and draws the learned plan at once, so it is the case to drag the controls on.",
        "es": "El pórfido menor: el navegador re-resuelve su cota y tres planes en cerca de dos segundos y dibuja el plan aprendido de inmediato, así que es el caso para mover los controles."
      }
    },
    {
      "case_id": "twin-vein",
      "category": "deposit",
      "manifest_path": "manifests/twin-vein.json",
      "default": false,
      "lane": "live",
      "title": {
        "en": "Vein twin",
        "es": "Gemelo de veta"
      },
      "role": {
        "en": "A narrow high-grade body. The stress test for spatial coherence (the optimiser wants the vein and the vein is not a workable shape) and for Gershon's weight, which opens the whole strike length at once because every block above the vein unlocks it. With the core-halo it is one of the two archetypes on which the learned rung fails most.",
        "es": "Un cuerpo angosto de alta ley. La prueba de coherencia espacial (el optimizador quiere la veta y la veta no es una forma operable) y del peso de Gershon, que abre todo el largo del rumbo de una vez porque todo bloque sobre la veta la libera. Junto con el núcleo-halo es uno de los dos arquetipos en que el peldaño aprendido falla más."
      }
    },
    {
      "case_id": "zuck-small-declared",
      "category": "declared",
      "manifest_path": "manifests/zuck-small-declared.json",
      "default": false,
      "lane": "replay",
      "title": {
        "en": "Zuck small, declared scenario",
        "es": "Zuck small, escenario declarado"
      },
      "role": {
        "en": "A real block model with nearly nine times the blocks of newman1, under a scenario declared here because its published scheduling file is not reachable. The gap is against this product's certified bound, not a published one; the ultimate pit is still comparable with the published optimum.",
        "es": "Un modelo de bloques real con casi nueve veces los bloques de newman1, bajo un escenario declarado aquí porque su archivo de programación publicado no es alcanzable. La brecha es contra la cota certificada de este producto, no contra una publicada; el pit final sí es comparable con el óptimo publicado."
      }
    }
  ]
}
